<?xml version="1.0" encoding="UTF-8"?>
<xs:schema xmlns:xs="http://www.w3.org/2001/XMLSchema" elementFormDefault="qualified" attributeFormDefault="unqualified">
	<xs:element name="family">
		<xs:complexType>
			<xs:sequence>
				<xs:element name="metadata">
					<xs:complexType>
						<xs:sequence>
							<xs:element name="license" type="licenseType" minOccurs="0" maxOccurs="1"/>
							<xs:element name="name" type="xs:string"/>
							<xs:element name="description" type="xs:string"/>
							<xs:element name="author" type="xs:string"/>
							<xs:element name="URL" type="xs:string" minOccurs="0" maxOccurs="1"/>
						</xs:sequence>
					</xs:complexType>
				</xs:element>
				<xs:element name="stages">
					<xs:complexType>
						<xs:sequence>
							<xs:element name="scaleStage" type="scaleStageType" minOccurs="1" maxOccurs="10"/>
							<xs:element name="multiStage" type="multiStageType" minOccurs="1" maxOccurs="10"/>	
							<xs:element name="animationStage" type="animationStageType"/>
						</xs:sequence>
					</xs:complexType>
				</xs:element>
				<xs:element name="modelsRef">
					<xs:complexType>
						<xs:sequence>
							<xs:element name="modelRef" type="modelRefType" minOccurs="1" maxOccurs="unbounded"/>
						</xs:sequence>
					</xs:complexType>
				</xs:element>
			</xs:sequence>
		</xs:complexType>
	</xs:element>
	<xs:complexType name="licenseType">
		<xs:sequence>
			<xs:element name="title" type="xs:string"/>
			<xs:element name="terms" type="xs:string"/>
			<xs:element name="URL" type="xs:string" minOccurs="0" maxOccurs="1"/>
		</xs:sequence>
	</xs:complexType>
	<xs:complexType name="multiStageType">
		<xs:choice minOccurs="1" maxOccurs="unbounded">
			<xs:element name="meshSubStage" type="meshSubStageType"/>
			<xs:element name="textureSubStage" type="textureSubStageType"/>
		</xs:choice>
		<xs:attribute name="stageName" type="xs:string" use="required"/>
	</xs:complexType>
	<xs:complexType name="meshSubStageType">
		<xs:attribute name="subStageName" type="xs:string" use="required"/>
		<xs:attribute name="idPanel" type="xs:ID" use="required"/>
		<xs:attribute name="multiselection" type="xs:boolean" use="optional"/>
	</xs:complexType>
	<xs:complexType name="textureSubStageType">
		<xs:attribute name="subStageName" type="xs:string" use="required"/>
		<xs:attribute name="idPanel" type="xs:ID" use="required"/>
		<xs:attribute name="multiselection" type="xs:boolean" use="optional"/>
	</xs:complexType>
	<xs:complexType name="scaleStageType">
		<xs:sequence>
			<xs:element name="boneController" minOccurs="1" maxOccurs="10">
				<xs:complexType>
					<xs:attribute name="controllerName" type="xs:string" use="required"/>
					<xs:attribute name="idController" type="xs:ID" use="required"/>
				</xs:complexType>
			</xs:element>
		</xs:sequence>
		<xs:attribute name="stageName" type="xs:string" use="required"/>
		<xs:attribute name="idPanel" type="xs:ID" use="required"/>
	</xs:complexType>
	<xs:complexType name="animationStageType">
		<xs:sequence>
			<xs:element name="fps" type="fpsType" minOccurs="1" maxOccurs="unbounded"/>
			<xs:element name="camera" type="cameraType" minOccurs="1" maxOccurs="unbounded"/>
		</xs:sequence>
	</xs:complexType>
	<xs:complexType name="fpsType">
		<xs:attribute name="qualityName" type="xs:string" use="required"/>
		<xs:attribute name="fpsValue" type="xs:integer" use="required"/>
	</xs:complexType>
	<xs:complexType name="cameraType">
		<xs:sequence>
			<xs:element name="upAxis" type="vectorType"/>
			<xs:element name="location" type="vectorType"/>
			<xs:element name="direction" type="vectorType"/>
		</xs:sequence>
		<xs:attribute name="cameraName" type="xs:string" use="required"/>
	</xs:complexType>
	<xs:complexType name="vectorType">
		<xs:attribute name="valueX" type="xs:float" use="required"/>
		<xs:attribute name="valueY" type="xs:float" use="required"/>
		<xs:attribute name="valueZ" type="xs:float" use="required"/>
	</xs:complexType>
	<xs:complexType name="modelRefType">
		<xs:sequence>
			<xs:element name="modelName" type="xs:string"/>
			<xs:element name="iconPath" type="xs:string"/>
			<xs:element name="modelPath" type="xs:string"/>
		</xs:sequence>
	</xs:complexType>
</xs:schema>
