<?xml version="1.0" encoding="UTF-8"?>
<family xmlns:xsi="http://www.w3.org/2001/XMLSchema-instance" xsi:noNamespaceSchemaLocation="../family.xsd">
	<metadata>
		<name>idNameFamily</name>
		<abstract>idAbstractFamily</abstract>
		<description>idDescriptionFamily</description>
		<author>idAuthor</author>
		<languagesPath>assets/Families/Cubix Studio/Locale</languagesPath>
		<iconPath>assets/Families/Cubix Studio/Icons/IconoCubix.png</iconPath>
	</metadata>
	<stages>
		<scaleStage stageLabel="idMultiStageLabel1" idPanel="ScalePanel">
			<iconPath>assets/Families/Cubix Studio/Icons/IconosBarraSuperior_0000_Complexion.png</iconPath>
			<boneController controllerLabel="idBoneControler1" idController="head" level="0"/>
			<boneController controllerLabel="idBoneControler2" idController="arms" level="0"/>
			<boneController controllerLabel="idBoneControler3" idController="hands" level="0"/>
			<boneController controllerLabel="idBoneControler4" idController="legs" level="0"/>
			<boneController controllerLabel="idBoneControler5" idController="feet" level="0"/>
		</scaleStage>
		<multiStage stageLabel="idMultiStageLabel2">
			<iconPath>assets/Families/Cubix Studio/Icons/IconosBarraSuperior_0001_Piel.png</iconPath>
			<subStage subStageType="textureSubStage" subStageLabel="idTextureSubStageLabel1" idPanel="skinsPanel" multiselection="false"/>
		</multiStage>
		<multiStage stageLabel="idMultiStageLabel3">
			<iconPath>assets/Families/Cubix Studio/Icons/IconosBarraSuperior_0006_Pelo.png</iconPath>
			<subStage subStageType="textureSubStage" subStageLabel="idTextureSubStageLabel2" idPanel="hairsPanel" multiselection="false"/>
		</multiStage>
		<multiStage stageLabel="idMultiStageLabel4">
			<iconPath>assets/Families/Cubix Studio/Icons/IconosBarraSuperior_0002_Ojos.png</iconPath>
			<subStage subStageType="textureSubStage" subStageLabel="idTextureSubStageLabel3" idPanel="eyesPanel" multiselection="false"/>
		</multiStage>
		<multiStage stageLabel="idMultiStageLabel5">
			<iconPath>assets/Families/Cubix Studio/Icons/IconosBarraSuperior_0003_Camiseta.png</iconPath>
			<subStage subStageType="textureSubStage" subStageLabel="idTextureSubStageLabel4" idPanel="shirtsPanel" multiselection="false"/>
			<subStage subStageType="textureSubStage" subStageLabel="idTextureSubStageLabel5" idPanel="trousersPanel" multiselection="false"/>
                        <!--<subStage subStageType="textureSubStage" subStageLabel="idTextureSubStageLabel5b" idPanel="baseColorPanel" multiselection="false"/>-->
		</multiStage>
		<multiStage stageLabel="idMultiStageLabel6">
			<iconPath>assets/Families/Cubix Studio/Icons/IconosBarraSuperior_0005_Calzado.png</iconPath>
			<subStage subStageType="textureSubStage" subStageLabel="idTextureSubStageLabel6" idPanel="shoesPanel" multiselection="false"/>
		</multiStage>
		<multiStage stageLabel="idMultiStageLabel7">
			<iconPath>assets/Families/Cubix Studio/Icons/IconosBarraSuperior_0007_Accesorios.png</iconPath>
			<subStage subStageType="textureSubStage" subStageLabel="idTextureSubStageLabel7" idPanel="accesoriesPanel" multiselection="true"/>
		</multiStage>
		<animationStage stageLabel="idAnimationStageLabel1">
			<fps qualityLabel="idQualityLabel1" fpsValue="24"/>
			<fps qualityLabel="idQualityLabel2" fpsValue="12"/>
			<fps qualityLabel="idQualityLabel3" fpsValue="6"/>
			<camera cameraLabel="idCameraLabel1">
				<upAxis valueX="0.0" valueY="1.0" valueZ="0.0"/>
				<location valueX="0.0" valueY="0.0" valueZ="11.0"/>
				<direction valueX="0.0" valueY="0.0" valueZ="-1.0"/>
			</camera>
			<camera cameraLabel="idCameraLabel2">
				<upAxis valueX="0.0" valueY="1.0" valueZ="0.0"/>
				<location valueX="-2.25" valueY="2.0" valueZ="11.0"/>
				<direction valueX="0.0" valueY="0.0" valueZ="-1.0"/>
			</camera>
		</animationStage>
	</stages>
	<modelsRef>
		<modelRef>
			<modelLabel>idModelLabel1</modelLabel>	
			<iconPath>assets/Families/Cubix Studio/Icons/Cubix-Hombre.png</iconPath>
			<modelPath>assets/Families/Cubix Studio/XML models/Male.xml</modelPath>
		</modelRef>
		<modelRef>
			<modelLabel>idModelLabel2</modelLabel>
			<iconPath>assets/Families/Cubix Studio/Icons/Cubix-Mujer.png</iconPath>
			<modelPath>assets/Families/Cubix Studio/XML models/Female.xml</modelPath>
		</modelRef>	
	</modelsRef>
</family>
